{
  "$schema": "../../schemas/deck-schema-v1.json",
  "version": "1.0.0",
  "deck_id": "core-v1",
  "name": "Krabs Against Security Core Set v1",
  "description": "Canonical 80-card incident response tabletop deck pairing undersea Krusty Krab SOC parody lore with authentic MITRE ATT&CK techniques and NIST SP 800-61r2 incident handling phases.",
  "license": "CC BY-SA 4.0",
  "attribution": "Based on Backdoors & Breaches by Black Hills Information Security (BHIS), licensed under CC BY-SA 4.0.",
  "card_counts": {
    "initial_compromise": 12,
    "pivot_escalate": 12,
    "persistence": 12,
    "c2_exfil": 12,
    "procedures": 16,
    "injects": 16,
    "total": 80
  },
  "cards": [
    {
      "id": "IC-001",
      "slug": "spear-phishing-actual-chum",
      "title": "Spear Phishing with Actual Chum",
      "deck": "initial_compromise",
      "type": "initial_compromise",
      "nist_phase": "Detection & Analysis",
      "art_id": "ART-IC-001",
      "attack_technique_id": "T1566.001",
      "attack_technique_name": "Spearphishing Attachment",
      "description": "An urgent promotional email offering a 90% discount on bulk kelp flour arrives with an attached macro-enabled Excel sheet named 'invoice_october.xlsm'. When opened by an eager executive, it drops an obfuscated subsea PowerShell stager.",
      "flavor_text": "\"Ninety percent off?! Eugene Krabs never turns down a bargain, even if the sender is pl4nkt0n@chumbucket.ru!\"",
      "tags": [
        "phishing",
        "macro",
        "social-engineering",
        "initial-access"
      ]
    },
    {
      "id": "IC-002",
      "slug": "unpatched-kelp-facing-server",
      "title": "Unpatched Kelp-Facing Server",
      "deck": "initial_compromise",
      "type": "initial_compromise",
      "nist_phase": "Detection & Analysis",
      "art_id": "ART-IC-002",
      "attack_technique_id": "T1190",
      "attack_technique_name": "Exploit Public-Facing Application",
      "description": "A legacy FreeBSD web server from 1999 hosting the Krusty Krab menu remains exposed to the open ocean internet without security updates, allowing Plankton to execute remote code via an unauthenticated buffer overflow.",
      "flavor_text": "\"Why pay for security updates when the website has loaded fine since the Clinton administration?\"",
      "tags": [
        "rce",
        "unpatched",
        "legacy-server",
        "public-facing"
      ]
    },
    {
      "id": "IC-003",
      "slug": "salty-insider-oyster-ducky",
      "title": "Salty Insider Oyster Ducky",
      "deck": "initial_compromise",
      "type": "initial_compromise",
      "nist_phase": "Detection & Analysis",
      "art_id": "ART-IC-003",
      "attack_technique_id": "T1091",
      "attack_technique_name": "Replication Through Removable Media",
      "description": "A disgruntled, minimum-wage cashier plugs a malicious USB Rubber Ducky disguised as a polished oyster shell into the back of the primary POS cash register to charge a music player.",
      "flavor_text": "\"I just wanted to charge my Clarinet MP3 player, Mr. Krabs! How was I supposed to know it typed 400 keystrokes a second?!\"",
      "tags": [
        "usb-ducky",
        "insider-threat",
        "removable-media",
        "pos"
      ]
    },
    {
      "id": "IC-004",
      "slug": "trench-floor-physical-intrusion",
      "title": "Trench Floor Physical Intrusion",
      "deck": "initial_compromise",
      "type": "initial_compromise",
      "nist_phase": "Detection & Analysis",
      "art_id": "ART-IC-004",
      "attack_technique_id": "T1200",
      "attack_technique_name": "Direct Physical Access",
      "description": "A microscopic threat actor physically crawls through the kitchen floor drainage conduit, bypassing the front door biometric lock, and clips a hardware packet sniffer directly onto the main server rack switch.",
      "flavor_text": "\"Physical security policy stated all floor drains must have a two-cent mesh cover. Mr. Krabs substituted chicken wire.\"",
      "tags": [
        "physical-access",
        "hardware-implant",
        "drain-infiltration"
      ]
    },
    {
      "id": "IC-005",
      "slug": "supply-chain-kelp-poisoning",
      "title": "Supply Chain Kelp Poisoning",
      "deck": "initial_compromise",
      "type": "initial_compromise",
      "nist_phase": "Detection & Analysis",
      "art_id": "ART-IC-005",
      "attack_technique_id": "T1195.002",
      "attack_technique_name": "Supply Chain Compromise: Compromise Software Supply Chain",
      "description": "Threat actors publish a malicious update to the popular open-source package '@krusty-delivery/pos-driver' on the subsea npm registry, embedding a backdoor that harvests payment credentials.",
      "flavor_text": "\"Four lines of malicious JavaScript in a library that calculates delivery tip percentages. Elegantly devious.\"",
      "tags": [
        "supply-chain",
        "npm",
        "dependency-confusion",
        "open-source"
      ]
    },
    {
      "id": "IC-006",
      "slug": "default-credentials-fryer-scada",
      "title": "Default Credentials on Fryer SCADA",
      "deck": "initial_compromise",
      "type": "initial_compromise",
      "nist_phase": "Detection & Analysis",
      "art_id": "ART-IC-006",
      "attack_technique_id": "T1078.001",
      "attack_technique_name": "Valid Accounts: Default Accounts",
      "description": "The automated deep-fryer temperature controller was deployed with factory default credentials (admin/krabby123) exposed over unencrypted Modbus TCP on the internal restaurant network.",
      "flavor_text": "\"Changing default passwords voids the warranty! Do you know how much a new thermistor controller costs?!\"",
      "tags": [
        "default-credentials",
        "scada",
        "iot",
        "fryer"
      ]
    },
    {
      "id": "IC-007",
      "slug": "drive-by-download-goo-lagoon",
      "title": "Drive-by Download at Goo Lagoon",
      "deck": "initial_compromise",
      "type": "initial_compromise",
      "nist_phase": "Detection & Analysis",
      "art_id": "ART-IC-007",
      "attack_technique_id": "T1189",
      "attack_technique_name": "Drive-by Compromise",
      "description": "An assistant manager browsing a popular beach weather forecast forum falls victim to a watering-hole drive-by download exploiting an unpatched web browser vulnerability to drop memory-resident shellcode.",
      "flavor_text": "\"I only checked the surf report! Then the monitor started shooting bioluminescent purple sparks!\"",
      "tags": [
        "drive-by",
        "browser-exploit",
        "zero-day",
        "goo-lagoon"
      ]
    },
    {
      "id": "IC-008",
      "slug": "watering-hole-kelp-shake-stand",
      "title": "Watering Hole at Kelp Shake Stand",
      "deck": "initial_compromise",
      "type": "initial_compromise",
      "nist_phase": "Detection & Analysis",
      "art_id": "ART-IC-008",
      "attack_technique_id": "T1195.001",
      "attack_technique_name": "Supply Chain Compromise: Compromise Software Dependencies and Development Tools",
      "description": "Adversaries compromise the local online ordering portal of the popular Kelp Shake franchise frequented by Krusty Krab staff, poisoning downloadable order receipts with malicious macro payloads.",
      "flavor_text": "\"Everyone drinks Kelp Shakes on Friday afternoon. Perfect place to poison both the drinks and the network perimeter.\"",
      "tags": [
        "watering-hole",
        "kelp-shake",
        "macro",
        "credential-harvesting"
      ]
    },
    {
      "id": "IC-009",
      "slug": "misconfigured-s3-coral-bucket",
      "title": "Misconfigured S3 Coral Bucket",
      "deck": "initial_compromise",
      "type": "initial_compromise",
      "nist_phase": "Detection & Analysis",
      "art_id": "ART-IC-009",
      "attack_technique_id": "T1530",
      "attack_technique_name": "Data from Cloud Storage Object",
      "description": "An AWS S3 cloud storage bucket named 'krusty-internal-confidential-recipes' was accidentally set to Public-Read during a late-night deployment to speed up branch synchronization.",
      "flavor_text": "\"Public read access made the kitchen terminals sync so much faster! Who knew 'world' meant the entire ocean?!\"",
      "tags": [
        "cloud",
        "s3",
        "misconfiguration",
        "data-leak"
      ]
    },
    {
      "id": "IC-010",
      "slug": "vishing-the-eager-fry-cook",
      "title": "Voice Phishing (Vishing) the Fry Cook",
      "deck": "initial_compromise",
      "type": "initial_compromise",
      "nist_phase": "Detection & Analysis",
      "art_id": "ART-IC-010",
      "attack_technique_id": "T1566.004",
      "attack_technique_name": "Spearphishing Voice",
      "description": "An attacker posing as Undersea Corporate IT calls the kitchen line claiming an emergency patch is required for the digital spatula, tricking a naive fry cook into reciting their multi-factor push code.",
      "flavor_text": "\"'Hello, this is Todd from IT. We need your six-digit MFA code to disinfect the digital spatula.' 'Golly, right away Todd!'\"",
      "tags": [
        "vishing",
        "social-engineering",
        "mfa-bypass",
        "human-error"
      ]
    },
    {
      "id": "IC-011",
      "slug": "exposed-coral-rdp-default-port",
      "title": "Exposed Coral RDP on Default Port",
      "deck": "initial_compromise",
      "type": "initial_compromise",
      "nist_phase": "Detection & Analysis",
      "art_id": "ART-IC-011",
      "attack_technique_id": "T1133",
      "attack_technique_name": "External Remote Services",
      "description": "Remote Desktop Protocol (TCP 3389) on the primary accounting workstation is routed directly through the gateway without VPN or brute-force lockouts so the owner can count coins from home.",